181,"b'The French Bullhuahua is a mixed breed dog\xe2\x80\x93a cross between the Chihuahua and French Bulldog breeds. Compact, spunky, and loyal, these pups inherited some of the best qualities from both of their parents.French Bullhuahuas go by several names, including Frencheenie, Chibull, and Mexican Frenchie. Despite their unfortunate status as a designer breed, you can find these mixed breed dogs in shelters and breed specific rescues, so remember to adopt! Don\xe2\x80\x99t shop!These cute pups make excellent apartment dogs for urban dwellers, and they also fare well in small or single-person households. These little firecracker dogs can be somewhat vocal or \xe2\x80\x9cyappy,\xe2\x80\x9d making them great alert dogs. If you want a spunky snuggle buddy who will keep you on your toes and love you unconditionally, the French Bullhuahua may be the right dog for you!Check out this de-shedding tool, perfect for this mixed breed\xe2\x80\x99s short hair! Or this harness that will fit your French Bullhuahua\xe2\x80\x99s smaller frame!See below for all mixed dog breed traits and facts about French Bullhuahuas!French Bullhuahua Mixed Dog Breed Pictures French Bullhuahua Mixed Dog Breed Pictures, Characteristics, & FactsInitiate Gallery'",10 to 15 years',4,4,2,2,3,3,4,3,3,3,3,5,3,1,4,2,3,4,3,3,4,4,3,4,2,2,Mixed Breed Dogs',6 to 12 inches',https://dogtime.com/dog-breeds/french-bullhuahua,10 to 30 pounds'
182,"b'The French Spaniel is a purebred dog from France and Canada. These dogs are sociable, intelligent, and gentle, which make up some of the best qualities in any pooch.The French Spaniel goes by several names, including Epagneul Francais, French Setter, and Canadian Setter. Despite their status as a pure breed, you may find these dogs in shelters and rescues, so remember to adopt! Don\xe2\x80\x99t shop!These beautiful dogs make great companions for those who are naturally active. They are not well-suited for apartment living as they need space to run and expend their energy. They are great pets for any type of household, including families with children of all ages. If you want an energetic and active dog who will keep you on your toes, then this breed might be right for you!See below for all dog breed traits and facts about French Spaniels!French Spaniel Dog Breed Pictures French Spaniel Dog Breed Pictures, Characteristics, & FactsInitiate Gallery'",10 to 12 years.',2,5,4,2,5,4,4,4,4,3,4,2,3,3,2,2,3,3,4,4,2,4,4,2,3,4,Sporting Dogs',21 to 24 inches.',https://dogtime.com/dog-breeds/french-spaniel,45 to 60 pounds.'
183,"b'The Frenchton is a mixed breed dog \xe2\x80\x94 a cross between the Boston Terrier and French Bulldog breeds.\xc2\xa0Sturdy, sociable, playful, and chill, these pups inherited some of the best qualities from both of their parents.Frenchtons are also called Frenchbo, Faux Frenchbo, and Froston. Despite their unfortunate status as a designer breed, you can find these pups, in shelters and breed-specific rescues, so remember to adopt. Don\xe2\x80\x99t shop!These outgoing pups are total charmers. They\xe2\x80\x99re easy traveling companions and could join their families on every adventure. They\xe2\x80\x99re also sweet-natured and love children of all ages.With plenty of love and some activities, a Frenchton would easily adapt to a small apartment. If you work long hours and would be away from your pup, however, this would not be the right dog for you. But if you work in a place that would allow you to bring your pup with you, this laid-back dog would love to join you and hang out wherever you are.See below for all Frenchton facts and mixed dog breed characteristics!Frenchton Mixed Dog Breed Pictures Frenchton Mixed Dog Breed Pictures, Characteristics, & FactsInitiate Gallery'",12 to 15 years',5,5,5,3,3,3,4,5,4,3,5,2,2,2,3,3,4,5,4,5,2,5,3,3,2,3,Mixed Breed Dogs',11 to 14 inches',https://dogtime.com/dog-breeds/frenchton,15 to 25 pounds'
184,"b'The Frengle is a mixed dog breed\xe2\x80\x93a cross between the French Bulldog and\xc2\xa0Beagle dog breeds. Charismatic, affectionate, and even-tempered, these pups inherited some of the best qualities from both of their parents.Frengles can also go by the name French Bulldog Beagle mix but rarely go by any other names. Despite their unfortunate status as a designer dog breed, you can find these mixed breed dogs in shelters and breed specific rescues, so remember to adopt! Don\xe2\x80\x99t shop!These good-natured pups are quite adaptable and make great apartment dogs as long as they\xe2\x80\x99re walked daily, but they will also enjoy living in a home with a backyard. They\xe2\x80\x99re not yappy dogs but will bark to alert their owners of any intruders. If you want a social, energetic, loyal, and fun-loving dog, the Frengle may be the right dog for you!See below for all Frengle facts and mixed dog breed characteristics!Frengle Mixed Dog Breed Pictures Frengle Mixed Dog Breed Pictures, Characteristics, & FactsInitiate Gallery'",10 to 15 years',4,5,4,1,4,4,4,4,4,3,5,4,3,3,2,3,3,5,3,4,3,5,4,2,3,2,Mixed Breed Dogs',8 to 15 inches',https://dogtime.com/dog-breeds/frengle,18 to 30 pounds'
185,"b'The German Longhaired Pointer is a multipurpose hunting dog breed that Germans started selectively breeding for their versatility and athleticism. Today, the German Longhaired Pointer, or GLP, is a gentle, loyal breed.Some fans of the breed refer to them simply as GLP. In their native country, they\xe2\x80\x99re called\xc2\xa0Deutsch-Langhaar, or the German Longhair.\xc2\xa0Although these are purebred dogs, you may still find them in shelters and rescues. Remember to adopt! Don\xe2\x80\x99t shop if this is the breed for you.As long as a German Longhaired Pointer gets plenty of exercise, this breed makes an amazing pet\xc2\xa0for active singles and families alike. They thrive in homes with yards or plenty of space to run, sniff, and romp. If you\xe2\x80\x99re looking for a loyal dog who will keep you as active as ever, the German Longhaired Pointer just might be the right breed for you!DogTime recommends this big, spacious crate to give your big GLP a place to rest and relax. You should also pick up this dog fetch toy to help burn off your pup\xe2\x80\x99s high energy!See below for complete list of dog breed traits and facts about German Longhaired Pointers!German Longhaired Pointer Dog Breed Pictures German Longhaired Pointer Dog Breed Pictures, Characteristics, & FactsInitiate Gallery'",11 to 14 years',2,5,4,3,5,5,4,2,4,3,4,4,3,4,2,4,2,5,4,4,2,3,3,3,3,3,Sporting Dogs',23 to 28 inches',https://dogtime.com/dog-breeds/german-longhaired-pointer,60 to 71 pounds'
186,"b'The German Pinscher dog breed is muscular and agile, powerful yet graceful. A medium-sized dog with an elegant appearance, they\xe2\x80\x99re admired as much for their beauty as for their intelligence.As the name implies, these pups originated in Germany. Although this is a pure breed of dog, you may find them in shelters and rescues, so remember to adopt! Don\xe2\x80\x99t shop if you decide this is the dog for you.German Pinschers are working dogs, guard dogs, and\xc2\xa0 devoted and loving family dogs. Although they can adapt to many living situations, their high intelligence and energy levels mean they will need lots of exercise. A home with a yard to run would be ideal.DogTime recommends this dog bed to give a good night\xe2\x80\x99s sleep to your medium-sized German Pinscher. You should also pick up this dog fetch toy to help burn off your pup\xe2\x80\x99s high energy!See all German Pinscher dog breed characteristics below!German Pinscher Dog Breed Pictures German Pinscher Dog Breed Information, Pictures, Characteristics & Facts - DogtimeInitiate Gallery'",12 to 14 years',3,5,2,1,5,5,4,3,5,3,3,3,5,3,4,4,3,5,4,2,3,5,4,3,3,3,Working Dogs',17 to 20 inches tall at the shoulder',https://dogtime.com/dog-breeds/german-pinscher,25 to 45 pounds'
187,"b'The German Shepherd Dog is one of America\xe2\x80\x99s most popular dog breeds\xc2\xa0\xe2\x80\x94 for good reasons. They\xe2\x80\x99re intelligent and capable working dogs. Their devotion and courage are unmatched. And they\xe2\x80\x99re amazingly versatile.The breed also goes by the name Alsatian. Despite their purebred status, you may find German Shepherds in shelters and breed specific rescues. So remember to adopt! Don\xe2\x80\x99t shop if this is the breed for you.GSDs excel at most anything they\xe2\x80\x99re trained to do: guide and assistance work for the handicapped, police and military service, herding, search and rescue, drug detection, competitive obedience, and \xe2\x80\x94 last but not least \xe2\x80\x94 faithful companion.See below for all dog breed traits and facts about German Shepherds!German Shepherd Dog Breed Pictures German Shepherd Dog Breed Information, Pictures, Characteristics & Facts - DogtimeInitiate Gallery Stuff For German Shepherd Dog Fans'",10 to 14 years',3,5,2,1,5,5,4,2,5,5,5,2,4,4,3,2,5,5,5,4,5,5,5,4,2,4,Herding Dogs',"1 foot, 10 inches to 2 feet, 2 inches tall at the shoulder'",https://dogtime.com/dog-breeds/german-shepherd-dog,75 to 95 pounds'
188,"b'The German Shepherd Pit Bull is a mixed breed dog\xe2\x80\x93a cross between the\xc2\xa0German Shepherd Dog\xc2\xa0and American Pit Bull Terrier breeds. Medium to large in size, energetic, and loyal, these pups inherited some of the best traits from both of their parents.The German Shepherd Pit Bull is also sometimes called the German Sheppit, German Pit, and Shepherd Pit. Despite their unfortunate status as a designer breed, you may find these pups in shelters and breed specific rescues, so remember to adopt! Don\xe2\x80\x99t shop!These pups are friendly in nature when they have proper socialization training, and they\xe2\x80\x99re loyal to a fault. Both parent breeds are hard working dogs. Due to their superior intelligence and athletic build they are often tasked with guarding and police work.An apartment probably wouldn\xe2\x80\x99t do for these pups. German Shepherd Pit Bulls need large homes with yards to run around. If given rigorous duties, you\xe2\x80\x99ll have one happy dog. When under-stimulated, these pups can become destructive and develop behavioral problems.DogTime recommends this dog bed to give a good night\xe2\x80\x99s sleep to your medium-sized German Shepherd Pit Bull.\xc2\xa0You should also pick up this dog water bottle for any outdoor adventures you have with your pup!See below for all German Shepherd Pit Bull facts and mixed dog breed characteristics!German Shepherd Pit Bull Mixed Dog Breed Pictures German Shepherd Pit Bull Mixed Dog Breed Pictures, Characteristics, & FactsInitiate Gallery'",10 to 12 years',1,5,4,1,5,5,4,1,5,5,5,4,4,4,3,3,5,5,5,4,5,5,4,4,1,3,Mixed Breed Dogs',17 to 26 inches',https://dogtime.com/dog-breeds/german-shepherd-pit-bull,30 to 90 pounds'
189,"b'The German Shepherd Rottweiler Mix is a a cross between the German Shepherd and Rottweiler dog breeds. Eenergetic, loyal, and as eager to play as they are to snuggle, these mixed breed pups inherited some of the best qualities from both of their parents.German Shepherd Rottweiler Mixes go by several different names, like the Rottie Shepherd or Rotten Shepherd\xe2\x80\x93a misnomer in terms of how loving and fun this mixed breed can be. Despite their unfortunate status as a designer breed, you may find these mixed breed dogs in shelters and breed specific rescues, so remember to adopt! Don\xe2\x80\x99t shop!These fluffy pups make great family dogs; however, they\xe2\x80\x99re best suited to homes that have access to a yard and space. Still, they can make great companions for active urban dwellers, too. If you want a goofy, kid-friendly dog who loves to play as much as they love to look out for their family, the German Shepherd Rottweiler Mix might be the right dog for you!DogTime recommends this big, spacious crate to give your big German Shepherd Rottweiler Mix a place to rest and relax.\xc2\xa0You should also pick up this dog fetch toy to help burn off your pup\xe2\x80\x99s high energy!See below for all\xc2\xa0German Shepherd Rottweiler Mix facts and mixed dog breed characteristics!German Shepherd Rottweiler Mixed Dog Breed Pictures German Shepherd Rottweiler Mixed Dog Breed Pictures, Characteristics, & FactsInitiate Gallery'",9 to 13 years',3,4,3,3,4,4,3,4,4,3,4,4,3,4,2,2,5,3,3,3,3,4,3,3,3,4,Mixed Breed Dogs',22 to 28 inches',https://dogtime.com/dog-breeds/german-shepherd-rottweiler-mix,75 to 115 pounds'
190,,,,,,,,,,,,,,,,,,,,,,,,,,,,,,,https://dogtime.com/dog-breeds/german-sheprador,
191,"b'The versatile\xc2\xa0German Shorthaired Pointer\xc2\xa0sporting dog\xc2\xa0breed hunts many types of game, retrieves on land or from water, and is an affectionate companion. They have a striking, easy-care coat, but they need plenty of vigorous exercise.If you can provide this dog with the mental and physical challenges they crave, they\xe2\x80\x99ll be your best four-legged friend. But those who live in apartments or spend lots of time away from home must beware. Without room to play and lots of exercise, you may find a bored dog engaging in destructive behaviors when you get home.DogTime recommends this dog bed to give a good night\xe2\x80\x99s sleep to your medium-sized German Shorthaired Pointer.\xc2\xa0You should also pick up this dog fetch toy to help burn off your pup\xe2\x80\x99s high energy!See all dog breed traits and facts about German Shorthaired Pointers below!German Shorthaired Pointer Dog Breed Pictures German Shorthaired Pointer Dog Breed Information, Pictures, Characteristics & Facts - DogtimeInitiate Gallery'",12 to 15 years',1,5,4,2,5,5,3,2,5,3,5,3,5,3,4,5,2,5,5,3,4,5,4,3,1,2,Sporting Dogs',"1 foot, 9 inches to 2 feet, 1 inch tall at the shoulder'",https://dogtime.com/dog-breeds/german-shorthaired-pointer,45 to 70 pounds'
192,"b'The German Spitz is one of the oldest dog breeds originating from Europe. Attentive, energetic, and devoted, these pups have some of the best qualities among any dog breed around.German Spitzes go by several other names such as Spitz, German Spitz Mittelspitz, and Deutscher Spitz. If you\xe2\x80\x99d like to bring home a dog of this breed, look for them at your local shelter or rescue. Remember, adopt a pup, and don\xe2\x80\x99t shop!These adorable pooches can make great apartment dogs due to their small stature and are suited for any type of household or family, though they have a tendency to be yappy. If you want an energetic \xe2\x80\x9cfirecracker\xe2\x80\x9d dog who will keep you on your toes, alert you to any potential dangers, and love you unconditionally, this may be the right dog for you!See below for all dog breed traits and facts about German Spitzes!German Spitz Dog Breed Pictures German Spitz Dog Breed Pictures, Characteristics, & FactsInitiate Gallery'",13 to 15 years',4,5,3,1,5,4,4,2,4,3,4,4,5,1,2,2,4,2,2,3,4,4,3,4,3,3,Companion Dogs',12 to 15 inches',https://dogtime.com/dog-breeds/german-spitz,21 to 29 pounds'
193,"b'The German Wirehaired Pointer was developed in the late 19th and early 20th centuries to be a versatile hunting dog breed, a job at which they still excel today. They can hunt any game on any terrain and point and retrieve from land or water.Their excellent noses and stamina are appreciated by hunters worldwide, but they\xe2\x80\x99re also great companions for active families who can provide an outlet for this dog\xe2\x80\x99s high energy levels.DogTime recommends this dog bed to give a good night\xe2\x80\x99s sleep to your medium-sized German Wirehaired Pointer.\xc2\xa0You should also pick up this dog fetch toy to help burn off your pup\xe2\x80\x99s high energy!See all dog breed traits and facts about German Wirehaired Pointers below!German Wirehaired Pointer Dog Breed Pictures German Wirehaired Pointer Dog Breed Information, Pictures, Characteristics & Facts - DogtimeInitiate Gallery'",12 to 14 years',2,5,3,2,5,5,4,3,5,4,3,3,4,4,4,5,2,4,4,2,4,5,4,3,2,3,Sporting Dogs',"1 foot, 10 inches to 2 feet, 2 inches tall at the shoulder'",https://dogtime.com/dog-breeds/german-wirehaired-pointer,60 to 70 pounds'
194,"b'The Giant Schnauzer was created to be a working dog breed, so they have intelligence and drive. They can be a loyal and courageous companion for the person who can provide them with the training, exercise, and attention they need.These pups originated in Germany, where they had jobs like driving cattle, working in butcher shops and stockyards, and even guarding breweries. Although this is a pure breed of dog, you may find them in shelters and rescues, so remember to adopt! Don\xe2\x80\x99t shop if you decide this is the dog for you.Giant Schnauzers love to play and have high energy. They do best in homes with big yards to run and get plenty of exercise. Apartment life generally isn\xe2\x80\x99t for them, and novice trainers beware. However, if you want a loyal guardian and energetic companion, this pooch may be your new best friend!DogTime recommends this big, spacious crate to give your big Giant Schnauzer a place to rest and relax.\xc2\xa0You should also pick up this dog fetch toy to help burn off your pup\xe2\x80\x99s high energy!See all Giant Schnauzer dog breed characteristics below!Giant Schnauzer Dog Breed Pictures Giant Schnauzer Dog Breed Information, Pictures, Characteristics & Facts - DogtimeInitiate Gallery'",10 to 12 years',1,5,3,1,5,5,4,1,4,2,3,3,4,4,2,4,4,2,5,2,3,5,4,4,2,4,Working Dogs',23 to 27 inches tall at the shoulder',https://dogtime.com/dog-breeds/giant-schnauzer,55 to 80 pounds'
195,"b'The Glen of Imaal Terrier is a strong, independent dog breed named for the remote valley in Ireland where they originated. Bred to hunt fox and badger, and to keep homes free of rodents, the Glen is a skilled and cunning hunter. They\xe2\x80\x99re also an affectionate family dog, gentle, and loving with their people.Even though these are purebred dogs, some may still end up in the care of shelters or rescues. Consider adoption if this is the breed for you.Compact and easy to groom, these dogs can adapt to apartments and large homes easily so long as they get enough exercise and active playtime. Due to their history of hunting small game, Glen of Imaal Terriers retain their love of digging. You may want to create a designated digging area outdoors to let your dog get the urge out of their system. Start training and socializing your pup from an early age, and you\xe2\x80\x99ll be rewarded with a loving, lifelong companion.DogTime recommends this carrier for traveling with your small Glen of Imaal Terrier.\xc2\xa0You should also pick up this dog water bottle for any outdoor adventures you have with your pup!See below for complete list of Glen of Imaal Terrier dog breed facts and characteristics!Glen of Imaal Terrier Dog Breed Pictures Glen of Imaal Terrier Dog Breed Information, Pictures, Characteristics & Facts \xe2\x80\x93 DogtimeInitiate Gallery'",12 to 15 years',4,5,2,1,4,4,5,2,4,5,5,3,5,1,4,3,1,5,4,3,3,4,3,4,3,3,Terrier Dogs',12 to 14 inches tall at the shoulder',https://dogtime.com/dog-breeds/glen-of-imaal-terrier,Up to 35 pounds'
196,"b'The Goberian is a mixed breed dog \xe2\x80\x94 a cross between the Golden Retriever and Siberian Husky dog breeds. Friendly, energetic, and smart, these pups inherited some of the best qualities from both of their parents.You may find these mixed breed dogs in shelters and rescues, so remember to always adopt! Don\xe2\x80\x99t shop if you\xe2\x80\x99re looking to add a Goberian to your home!Goberians make for great family dogs. They are extremely friendly, renowned for their good temperament, and enjoy being around people. The devoted mixed breed is an excellent companion and will come to look on you and your family as their best friends. However, you\xe2\x80\x99ll need to make sure you provide adequate exercise for your Goberian to ward off any antisocial habits \xe2\x80\x94 this is a dog breed that loves to go hiking, jogging and take extended trips to the local dog park. Such an active breed is not a good fit for an apartment dweller.See below for all mixed dog breed traits and facts about Goberians!Goberian Mixed Dog Breed Pictures Goberian Mixed Dog Breed Pictures, Characteristics, & FactsInitiate Gallery'",10 to 15 years',1,4,4,1,5,5,4,2,5,4,4,4,4,4,2,4,2,5,2,2,3,4,3,2,2,5,Mixed Breed Dogs',20 to 24 inches',https://dogtime.com/dog-breeds/goberian,45 to 90 pounds'
197,"b'Loving, devoted, and energetic, Goldador mixed breed dogs are prized for their good-natured trainability. As a cross between the Golden Retriever and Labrador Retriever, this mix inherited some of the best traits from both purebred parents.Although these dogs sometimes have the unfortunate status of \xe2\x80\x9cdesigner breed,\xe2\x80\x9d you may find them in the care of shelters and rescue groups.\xc2\xa0Remember to\xc2\xa0adopt! Don\xe2\x80\x99t shop if you want to bring a dog home.Goldadors make great family members \xe2\x80\x94 they\xe2\x80\x99re naturals with kids and social with other pets \xe2\x80\x94 as well as valuable guide, service, and bomb detection dogs. Affectionate and friendly, they can even make great companions for novice pet parents. However, they are highly energetic dogs and need plenty of exercise. Make sure you can commit to lots of daily walks and active play sessions before you bring this mix home. If you can, you\xe2\x80\x99ll have a happy, loving, and loyal member of the family.See below for complete list of mixed dog breed traits and facts about Goldadors!Goldador Mixed Dog Breed Pictures Goldador Mixed Dog Breed Information, Pictures, Characteristics & Facts \xe2\x80\x93 DogTimeInitiate Gallery'",10 to 15 years',2,5,5,2,5,5,4,4,5,5,5,3,1,4,4,4,3,4,4,5,2,5,3,1,4,5,Hybrid Dogs',22 to 24 inches tall at the shoulder',https://dogtime.com/dog-breeds/goldador,60 to 80 pounds'
198,"b'The Golden Cocker Retriever is a mixed breed dog\xe2\x80\x93a cross between the Golden Retriever and Cocker Spaniel dog breeds. Sweet, playful, and intelligent, these pups inherited some of the best qualities from both of their parents.Golden Cocker Retrievers also go by the names Cogol and Dakota Sport Retriever. You can find these mixed breed dogs in shelters and breed-specific rescues, so remember to always adopt! Don\xe2\x80\x99t shop if you\xe2\x80\x99re looking to add a one of these sweet pups to your home!The Golden Cocker Retriever is a super affectionate and extra playful pooch. This is a mixed breed that makes for a top notch family dog\xe2\x80\x93the\xe2\x80\x99ll want to be involved in all of your daily activities, whether that\xe2\x80\x99s snuggling and lounging on the couch or heading out on hikes and running errands. Although speaking about activities, the Golden Cocker Retriever is an energetic breed that will require a high amount of exercise\xe2\x80\x93this is not an apartment dog.See below for all mixed dog breed traits and facts about Golden Cocker Retrievers!Golden Cocker Retriever Mixed Dog Breed Pictures Golden Cocker Retriever Mixed Dog Breed Pictures, Characteristics, & FactsInitiate Gallery'",12 to 15 years',1,5,4,1,5,4,4,4,4,2,4,4,2,3,4,4,4,4,4,3,2,5,4,3,1,2,Mixed Breed Dogs',20 to 24 inches',https://dogtime.com/dog-breeds/golden-cocker-retriever,30 to 45 pounds'
199,"b'The Golden Mountain Dog is a mixed breed dog\xe2\x80\x93a cross between the Golden Retriever and Bernese Mountain Dog breeds. Gentle, friendly and intelligent, these pups inherited some of the best qualities from both of their parents.You can find these mixed breed dogs in shelters and breed specific rescues, so remember to always adopt! Don\xe2\x80\x99t shop if you\xe2\x80\x99re looking to add a Golden Mountain Dog to your home!If you\xe2\x80\x99re a fan of larger-than-life dogs but are also looking for a mixed breed that\xe2\x80\x99s very much a gentle giant, the Golden Mountain Dog is for you. The mixed breed makes an excellent family dog and gets along great with small children and other family pets alike. They\xe2\x80\x99re loyal, affectionate, highly intelligent, and willing to please. Just take note: They definitely prefer living in places where the weather is on the colder side, and definitely aren\xe2\x80\x99t apartment dogs.See below for all mixed dog breed traits and facts about Golden Mountain Dogs!Golden Mountain Dog Mixed Dog Breed Pictures Golden Mountain Dog Mixed Dog Breed Pictures, Characteristics, & FactsInitiate Gallery'",9 to 15 years',1,5,4,4,4,5,3,2,4,2,5,4,2,5,1,4,4,2,4,3,2,5,2,3,2,5,Mixed Breed Dogs',24 to 28 inches',https://dogtime.com/dog-breeds/golden-mountain-dog,75 to 120 pounds'
