87,"b'In their native Italy, the Bracco Italiano is known as a hunting dog breed, but they\xe2\x80\x99re also gaining notice as a sweet and affectionate family companion. With their long ears, droopy lips, and soulful expression, the Bracco Italiano has a distinctive look. They\xe2\x80\x99re believed to be an ancient breed, dating back to the fourth or fifth century B.C.The Bracco Italiano goes by a number of other names, including Italian Pointer, The Italian Pointing Dog, and Bracco. If this dog breed interests you, then you may find these adorable pups in shelters or breed specific rescues. Remember, it\xe2\x80\x99s always better to adopt and not shop!These smart dogs have endless amounts of energy and do best in homes with yards. The Bracco is also well suited for all households, from single individuals to large families with children. Though they are not watchdog material, they will let you know if they sense a change in their environment. If you want an energetic dog who will keep you on your toes and love you unconditionally, the Bracco Italiano may be the right dog for you!See below for all dog breed traits and facts about Bracco Italianos!Bracco Italiano Dog Breed Pictures Bracco Italiano Dog Breed Information, Pictures, Characteristics & Facts - DogtimeInitiate Gallery'",10 to 14 years',1,5,5,2,4,5,2,2,4,4,4,3,5,4,3,3,3,5,3,3,2,4,4,2,3,3,Sporting Dogs',22 to 26 inches',https://dogtime.com/dog-breeds/bracco-italiano,55 to 90 pounds'
88,"b'The Braque du Bourbonnais is an ancient purebred pointing dog originally from the country of France. Affectionate, calm, and intelligent, these pups have some of the best qualities of any dog breed out there today.This breed goes by several other names, including Bourbonnais Pointer, Bourbonnais Pointing Dog, French Pointing Dog, French Pointer, Braques Francaises, and Braque Bourbonnais. Despite being a rare breed, you may still sometimes find these adorable pups in your local shelters and rescues, so remember to adopt! Don\xe2\x80\x99t shop!PB= PB || {};gptAds= PB.gptAds || {};var opts= {""asBool"":false,""adUnit"":""\\/4403\\/th\\/dogtime\\/dogbreeds"",""adDiv"":""dogbreeds_300x250_p_slot1"",""sizeStr"":""[[300, 250]]"",""mapping"":[{""viewport"":""[0, 0]"",""sizes"":""[]""},{""viewport"":""[750, 0]"",""sizes"":""[[300, 250]]""},{""viewport"":""[980, 0]"",""sizes"":""[[300, 250]]""}],""targeting"":{""pos"":""P"",""ct"":""article"",""ci"":""82851"",""content_detail"":1,""kw"":""high-energy,indoor,low-shedding,medium-dog,purebred,short-hair,in-article"",""coppa"":""0"",""site"":""dogtime""},""resize"":false,""autoRefresh"":false};PB.waitForAS= (opts.asBool) ? true : PB.waitForAS || false;admiralCookie = readAdmiralCookie();if (admiralCookie === null || admiralCookie[\'val\'] === \'false\') {PB.evGPTBuilder.enqueueAd(opts);}PB= PB || {};gptAds= PB.gptAds || {};var opts= {""asBool"":false,""adUnit"":""\\/4403\\/th\\/dogtime\\/dogbreeds"",""adDiv"":""pb_prebidjs_300x250_a"",""sizeStr"":""[[300, 250]]"",""mapping"":[{""viewport"":""[0, 0]"",""sizes"":""[[300, 250]]""},{""viewport"":""[750, 0]"",""sizes"":""[]""},{""viewport"":""[980, 0]"",""sizes"":""[]""}],""targeting"":{""pos"":""A"",""ct"":""article"",""ci"":""82851"",""content_detail"":1,""kw"":""high-energy,indoor,low-shedding,medium-dog,purebred,short-hair,in-article-mobile"",""coppa"":""0"",""site"":""dogtime""},""resize"":false,""autoRefresh"":false};PB.waitForAS= (opts.asBool) ? true : PB.waitForAS || false;admiralCookie = readAdmiralCookie();if (admiralCookie === null || admiralCookie[\'val\'] === \'false\') {PB.evGPTBuilder.enqueueAd(opts);}These affectionate pups are best suited for homes with yards and would not be recommended for apartment life. They are people-oriented and need to be around their humans, which makes them well suited for families or large households with more than one person at home. If you want a gentle and energetic pup, then the Braque du Bourbonnais may be the right dog for you!See below for all dog breed traits and facts about Braque du Bourbonnais dogs!Braque du Bourbonnais Dog Breed Pictures Braque du Bourbonnais Dog Breed Pictures, Characteristics, & FactsInitiate Gallery'",12 to 15 years.',1,5,4,1,5,5,4,3,4,2,4,1,4,3,3,2,2,4,4,4,3,3,3,3,2,2,Working Dogs',18 to 23 inches.',https://dogtime.com/dog-breeds/braque-du-bourbonnais,35 to 55 pounds.'
89,"b'Underneath the Briard\xe2\x80\x99s long, shaggy coat lies a bold spirit and keen intelligence. True to their French roots, they can be aloof with strangers, but are affectionate and loving toward members of their pack.Even though these are purebred dogs, you may find them in the care of shelters or rescue groups. Remember to\xc2\xa0adopt! Don\xe2\x80\x99t shop if you want to bring a dog home.Bred as herding and guard dogs to protect flocks and fight off predators, these canines were adopted as working dogs during World War I and used by troops as sentries, ammunition carriers, messengers, and medic dogs. Today, the Briard enjoys the life of a companion dog, but they show their versatility and working nature with their great successes in obedience, agility, conformation, herding, carting, and tracking competitions.See below for complete dog breed traits and facts about Briards!Briard Dog Breed Pictures Briard Dog Breed Information, Pictures, Characteristics & Facts \xe2\x80\x93 DogTimeInitiate Gallery'",10 to 12 years',3,4,5,1,4,4,3,3,4,4,5,3,3,4,3,5,1,1,4,2,2,4,4,4,3,4,Herding Dogs',22 to 27 inches tall at the shoulder',https://dogtime.com/dog-breeds/briard,70 to 100 pounds'
90,"b'Brittanys were bred as gundogs, and they definitely have birds on the brain. Although they\xe2\x80\x99re often called Brittany Spaniels, the American Kennel Club dropped the word \xe2\x80\x9cspaniel\xe2\x80\x9d from this pointing breed\xe2\x80\x99s name in 1982.These energetic dogs are versatile family companions and hunting dogs who work more closely to hunters than other pointing breeds. If you can satisfy their high energy and exercise needs, this may be the breed for you!DogTime recommends this dog bed to give a good night\xe2\x80\x99s sleep to your medium-sized Brittany.\xc2\xa0You should also pick up this dog water bottle for any outdoor adventures you have with your pup!See all dog breed traits and facts about Brittanys below!Brittany Dog Breed Pictures Brittany Dog Breed Information, Pictures, Characteristics & Facts - DogtimeInitiate Gallery'",10 to 13 years',1,5,5,5,5,5,4,3,5,3,5,3,5,3,3,4,3,3,3,4,3,5,5,3,1,4,Sporting Dogs',"1 foot, 5 inches to 1 foot, 8 inches tall at the shoulder'",https://dogtime.com/dog-breeds/brittany,30 to 40 pounds'
91,"b'The Broholmer is a large purebred dog from Denmark in northern Europe. Calm, protective, and friendly, this pup has some of the best qualities of any dog breed around!Broholmers go by a couple of other names, such as the Danish Mastiff or the Danish Broholmer. You may be able find these dogs at your local shelter or rescues. Please remember to adopt! Don\xe2\x80\x99t shop!These protective pooches can do fine in apartments but, because of their large size, are better suited for townhomes or something larger, preferably with a yard. They\xe2\x80\x99re pack dogs and like to be around people, so larger households or families with children are perfect for them. If you want a protective, calm, large pooch who will love you unconditionally, then this may be the right dog for you!See below for all dog breed traits and facts about Broholmers!Broholmer Dog Breed Pictures Broholmer Dog Breed Pictures, Characteristics, & FactsInitiate Gallery'",8 to 12 years.',2,5,3,2,3,3,4,4,4,3,4,3,2,5,3,2,3,4,4,3,3,3,3,3,3,3,Companion Dogs',22 to 30 inches.',https://dogtime.com/dog-breeds/broholmer,90 to 150 pounds.'
92,"b'Originally bred to hunt and kill rats, this former Belgian street dog is a distinctive and unusual dog breed. Although the Brussels Griffon is small, they\xe2\x80\x99re hardly a pampered pooch. Affectionate and lively, their intelligence, sense of humor, and air of self-importance keep them one step ahead of their people, who adore their pups anyway.Although these are purebred dogs, you may still find them in shelters and rescues. Remember to adopt! Don\xe2\x80\x99t shop if you want to bring a dog home.Griffons adapt well to apartment life, but the neighbors might not appreciate this tiny watchdog\xe2\x80\x99s tendency to sound off at any sign of what they believe to be trouble. These dogs also have quite a bit of energy for their size and need lots of exercise and playtime. Novice pet parents who expect a docile lapdog might find that this pup doesn\xe2\x80\x99t sit still as long as they were hoping. But humans who can meet the breed\xe2\x80\x99s needs and keep up with training will be rewarded with a loving, loyal family member.See below for complete list of dog breed traits and facts about Brussels Griffons!Brussels Griffon Dog Breed Pictures Brussels Griffon Dog Breed Information, Pictures, Characteristics & Facts \xe2\x80\x93 DogTimeInitiate Gallery'",12 to 15 years',5,5,4,3,5,4,3,2,4,3,4,3,1,1,2,5,3,3,3,3,3,5,5,4,1,1,Companion Dogs',7 to 8 inches tall at the shoulder',https://dogtime.com/dog-breeds/brussels-griffon,7 to 12 pounds'
93,"b'The Bugg is a mixed breed dog \xe2\x80\x94 a cross between the Boston Terrier and Pug\xc2\xa0dog breeds. Intelligent, affectionate, and spunky, these pups inherited some of the best traits from both of their parents.The Bugg is sometimes called the Pugin or simply the Boston Terrier Pug.\xc2\xa0Despite their unfortunate status as a designer breed, you can find these mixed breed dogs in shelters and breed specific rescues, so remember to adopt! Don\xe2\x80\x99t shop!These cute pups are great apartment and house dogs, alike. Since they don\xe2\x80\x99t require as much exercise as larger breeds, they\xe2\x80\x99re an excellent choice for seniors or first-time owners. Still, this mix is an intelligent, playful dog, and they love being the center of attention. If you are looking for a silly pooch who will be glued to your side most of the time, this may be the right dog for you!See below for all Bugg facts and mixed dog breed characteristics!Bugg Mixed Dog Breed Pictures Bugg Mixed Dog Breed Pictures, Characteristics, & FactsInitiate Gallery'",10 to 15 years',5,4,2,2,4,2,4,4,4,3,3,4,3,2,3,2,2,4,3,3,4,4,3,4,2,2,Mixed Breed Dogs',14 to 18 inches',https://dogtime.com/dog-breeds/bugg,10 to 25 pounds'
94,"b'The Bull-Pei is a mixed breed dog\xe2\x80\x93a cross between the Chinese Shar-Pei and\xc2\xa0English Bulldog breeds. Medium in size, loving, and loyal, these pups inherited some of the best traits from both of their parents.Despite their unfortunate status as a designer breed, you may find these pups in shelters and breed specific rescues, so remember to adopt! Don\xe2\x80\x99t shop!Bull-Peis make excellent companions and guard dogs without being too large or requiring much exercise. They\xe2\x80\x99re striking to look at because of their wrinkles. Just make sure that you have the time to keep your pup clean and dry, as they are prone to getting skin infections between the wrinkles.These dogs can live in apartments or houses. If you\xe2\x80\x99re looking for a chill companion dog who looks quite distinguished, the Bull-Pei may be perfect for you.DogTime recommends this carrier for traveling with your small Bull-Pei.\xc2\xa0You should also pick up this dog brush and massager for your short-haired pup!See below for all mixed dog breed traits and facts about Bull-Peis!Bull-Pei Mixed Dog Breed Pictures Bull-Pei Mixed Dog Breed Pictures, Characteristics, & FactsInitiate Gallery'",9 to 11 years',4,3,2,3,2,2,3,2,2,2,2,4,2,3,1,1,4,4,3,2,4,2,3,2,3,1,Mixed Breed Dogs',16 to 18 inches',https://dogtime.com/dog-breeds/bull-pei,35 to 65 pounds'
95,"b'The Bull Terrier was originally developed in the 19th century as a fighting dog and, later, a fashionable companion for gentlemen, but these days they\xe2\x80\x99re a family companion and show dog. They\xe2\x80\x99re a dog breed distinguished by their long, egg-shaped head.Even though these are purebred dogs, some may still end up in the care of shelters or rescues. Consider adoption if this is the breed for you.This dog is a lover, not a fighter. In fact, Bull Terriers are known for being affectionate to all the members of their household, especially children. Their friendliness and love of people also means they don\xe2\x80\x99t like to be left alone for long hours, though. They want to be a part of all their humans\xe2\x80\x99 daily activities. Because they have high energy and intensity, these dogs need plenty of exercise and vigorous playtime. If you can be firm and consistent with training, stay active to keep up with your pup, and provide plenty of love and attention, then this dog may be your new best friend!DogTime recommends this dog bed to give a good night\xe2\x80\x99s sleep to your medium-sized Bull Terrier.\xc2\xa0You should also pick up this dog brush and massager for your short-haired pup!See below for complete list of Bull Terrier dog breed facts and characteristics!Bull Terrier Dog Breed Pictures Bull Terrier Dog Breed Information, Pictures, Characteristics & Facts - DogtimeInitiate Gallery'",10 to 15 years',4,5,4,1,4,5,4,3,4,5,5,5,4,2,4,5,3,5,5,5,4,5,5,1,2,1,Terrier Dogs',21 to 22 inches tall at the shoulder',https://dogtime.com/dog-breeds/bull-terrier,35 to 75 pounds'
96,"b'The Bullador is a mixed breed dog\xe2\x80\x93a cross between the Labrador and\xc2\xa0English Bulldog breeds. These pups fall into the medium-to-large size range. Active and loyal, Bulladors inherited some of the best traits from both of their parents.Bulladors should not be confused with Labrabulls\xe2\x80\x93Labrador Retriever and Pit Bull mixes. Despite their unfortunate status as a designer breed, you can find these mixed pups in shelters and breed specific rescues, so remember to adopt! Don\xe2\x80\x99t shop!PB= PB || {};gptAds= PB.gptAds || {};var opts= {""asBool"":false,""adUnit"":""\\/4403\\/th\\/dogtime\\/dogbreeds"",""adDiv"":""dogbreeds_300x250_p_slot1"",""sizeStr"":""[[300, 250]]"",""mapping"":[{""viewport"":""[0, 0]"",""sizes"":""[]""},{""viewport"":""[750, 0]"",""sizes"":""[[300, 250]]""},{""viewport"":""[980, 0]"",""sizes"":""[[300, 250]]""}],""targeting"":{""pos"":""P"",""ct"":""article"",""ci"":""85533"",""content_detail"":1,""kw"":""english-bulldog-mix,high-energy,indoor,labrador-retriever-mix,medium-dog,mixed-breed,short-hair,in-article"",""coppa"":""0"",""site"":""dogtime""},""resize"":false,""autoRefresh"":false};PB.waitForAS= (opts.asBool) ? true : PB.waitForAS || false;admiralCookie = readAdmiralCookie();if (admiralCookie === null || admiralCookie[\'val\'] === \'false\') {PB.evGPTBuilder.enqueueAd(opts);}PB= PB || {};gptAds= PB.gptAds || {};var opts= {""asBool"":false,""adUnit"":""\\/4403\\/th\\/dogtime\\/dogbreeds"",""adDiv"":""pb_prebidjs_300x250_a"",""sizeStr"":""[[300, 250]]"",""mapping"":[{""viewport"":""[0, 0]"",""sizes"":""[[300, 250]]""},{""viewport"":""[750, 0]"",""sizes"":""[]""},{""viewport"":""[980, 0]"",""sizes"":""[]""}],""targeting"":{""pos"":""A"",""ct"":""article"",""ci"":""85533"",""content_detail"":1,""kw"":""english-bulldog-mix,high-energy,indoor,labrador-retriever-mix,medium-dog,mixed-breed,short-hair,in-article-mobile"",""coppa"":""0"",""site"":""dogtime""},""resize"":false,""autoRefresh"":false};PB.waitForAS= (opts.asBool) ? true : PB.waitForAS || false;admiralCookie = readAdmiralCookie();if (admiralCookie === null || admiralCookie[\'val\'] === \'false\') {PB.evGPTBuilder.enqueueAd(opts);}If you are a longtime dog parent and want to add a social, furry companion to your family, please step right up! Big homes with yards are ideal but not required. Bulladors can live in apartments as long as they get plenty of exercise and lots of love. They\xe2\x80\x99re protective of their loved ones and friendly with people, children, and other dogs. Don\xe2\x80\x99t leave them alone for long periods, though, or else they may become bored and destructive.DogTime recommends this dog bed to give a good night\xe2\x80\x99s sleep to your medium-sized Bullador.\xc2\xa0You should also pick up this dog brush and massager for your short-haired pup!See below for all Bullador facts and mixed dog breed characteristics!Bullador Mixed Dog Breed Pictures Bullador Mixed Dog Breed Pictures, Characteristics, & FactsInitiate Gallery'",10 to 12 years',2,4,4,4,4,4,3,2,4,4,4,5,4,4,2,3,4,4,4,4,2,4,4,4,2,2,Mixed Breed Dogs',17 to 20 inches',https://dogtime.com/dog-breeds/bullador,50 to 90 pounds'
97,"b'The Bullboxer Pit is a mixed breed dog \xe2\x80\x94 a cross between the Boxer and American Pit Bull Terrier dog breeds. Powerful, faithful, and energetic, these pups inherited some of the best traits from both of their parents.Bullboxer Pits are also sometimes called the Pixoter or American Bullboxer. You may find these mixed breed dogs in shelters and rescues, so remember to always adopt! Don\xe2\x80\x99t shop if you\xe2\x80\x99re looking to add one of these pups to your home!Bullboxer Pits can be loyal and protective companions, and they often bond well with children. But due to the dog\xe2\x80\x99s natural strength and sometimes stubborn streak, it is imperative that they are socialized both from a very young age and throughout their lifetime. Reward-based training works particularly well with this mixed breed. An attentive and responsible pet parent will bring the best out of the Bullboxer Pit.See below for all mixed dog breed traits and facts about Bullboxer Pits!Bullboxer Pit Mixed Dog Breed Pictures Bullboxer Pit Mixed Dog Breed Pictures, Characteristics, & FactsInitiate Gallery'",10 to 14 years',1,4,2,4,5,5,4,2,4,5,4,4,5,3,2,3,4,4,2,2,4,4,3,4,2,2,Mixed Breed Dogs',16 to 20 inches',https://dogtime.com/dog-breeds/bullboxer-pit,50 to 80 pounds'
98,"b'The Bulldog was originally used to drive cattle to market and to compete in a bloody sport called bullbaiting. Today, they\xe2\x80\x99re gentle companions who love kids.Even though these are purebred dogs, you may find them in the care of shelters or rescue groups. Remember to\xc2\xa0adopt! Don\xe2\x80\x99t shop if you want to bring a dog home.PB= PB || {};gptAds= PB.gptAds || {};var opts= {""asBool"":false,""adUnit"":""\\/4403\\/th\\/dogtime\\/dogbreeds"",""adDiv"":""dogbreeds_300x250_p_slot1"",""sizeStr"":""[[300, 250]]"",""mapping"":[{""viewport"":""[0, 0]"",""sizes"":""[]""},{""viewport"":""[750, 0]"",""sizes"":""[[300, 250]]""},{""viewport"":""[980, 0]"",""sizes"":""[[300, 250]]""}],""targeting"":{""pos"":""P"",""ct"":""article"",""ci"":""23140"",""content_detail"":1,""kw"":""dog-breed,indoor,low-energy,purebred,short-hair,small-dog,in-article"",""coppa"":""0"",""site"":""dogtime""},""resize"":false,""autoRefresh"":false};PB.waitForAS= (opts.asBool) ? true : PB.waitForAS || false;admiralCookie = readAdmiralCookie();if (admiralCookie === null || admiralCookie[\'val\'] === \'false\') {PB.evGPTBuilder.enqueueAd(opts);}PB= PB || {};gptAds= PB.gptAds || {};var opts= {""asBool"":false,""adUnit"":""\\/4403\\/th\\/dogtime\\/dogbreeds"",""adDiv"":""pb_prebidjs_300x250_a"",""sizeStr"":""[[300, 250]]"",""mapping"":[{""viewport"":""[0, 0]"",""sizes"":""[[300, 250]]""},{""viewport"":""[750, 0]"",""sizes"":""[]""},{""viewport"":""[980, 0]"",""sizes"":""[]""}],""targeting"":{""pos"":""A"",""ct"":""article"",""ci"":""23140"",""content_detail"":1,""kw"":""dog-breed,indoor,low-energy,purebred,short-hair,small-dog,in-article-mobile"",""coppa"":""0"",""site"":""dogtime""},""resize"":false,""autoRefresh"":false};PB.waitForAS= (opts.asBool) ? true : PB.waitForAS || false;admiralCookie = readAdmiralCookie();if (admiralCookie === null || admiralCookie[\'val\'] === \'false\') {PB.evGPTBuilder.enqueueAd(opts);}A brief walk and a nap on the sofa is just this dog breed\xe2\x80\x98s speed. Bulldogs can adapt well to apartment life and even make great companions for novice pet parents. They\xe2\x80\x99re affectionate with all members of the family and are fairly low-maintenance pups. Just make sure to keep them out of extreme weather, and also give them enough exercise, as weight gain is a risk with these dogs who are happy to spend most of the day on the couch.Did you know they make dog food specifically for Bulldogs?See below for complete list of dog breed traits and facts about Bulldogs!Bulldog Breed Pictures Bulldog Dog Breed Information, Pictures, Characteristics & Facts \xe2\x80\x93 DogTimeInitiate Gallery'",8 to 12 years',5,5,2,5,2,3,4,4,2,3,4,5,2,2,1,1,3,5,3,5,2,4,4,4,3,1,Companion Dogs',12 to 15 inches tall at the shoulder',https://dogtime.com/dog-breeds/bulldog,40 to 50 pounds'
99,"b'The Bullmastiff dog breed is a firm and fearless family guardian. While standoffish toward strangers, they\xe2\x80\x99ve got a soft spot for their loved ones.Called the \xe2\x80\x9csilent watchdog,\xe2\x80\x9d this breed is nonetheless so mellow that they make great apartment dogs. They have short, easy-care coats, but beware: These dogs are droolers. If you can get past a little slobber, you\xe2\x80\x99ll find a big, protective companion who will be happy to join you on adventures, so long as you save a spot on the couch for them afterward.DogTime recommends this big, spacious crate to give big Bullmastiffs a place to rest and relax.\xc2\xa0You should also pick up this dog brush and massager for your short-haired pup!See all Bullmastiff dog breed traits and facts below!Bullmastiff Dog Breed Pictures Bullmastiff Dog Breed Information, Pictures, Characteristics & Facts - DogtimeInitiate Gallery'",8 to 10 years',3,5,4,5,2,3,2,2,3,4,5,5,3,5,2,3,1,5,3,3,3,5,4,4,2,4,Working Dogs',24 to 27 inches at the shoulder',https://dogtime.com/dog-breeds/bullmastiff,100 to 130 pounds'
100,"b'The Bullmatian is a mixed breed dog \xe2\x80\x94 a cross between the Bulldog and Dalmatian dog breeds. Loving, energetic, and friendly, these pups inherited some of the best qualities from both of their parents.You may find these mixed breed dogs in shelters and breed specific rescues, so remember to always adopt! Don\xe2\x80\x99t shop if you\xe2\x80\x99re looking to add a Bullmatian to your home!Bullmatians are top-notch companion dogs. This mixed breed is known to be loving and friendly and also does very well around children. However, this energetic dog will need a high amount of regular exercise and a variety of play sessions. If you\xe2\x80\x99re a rookie dog owner, then you should know that Bullmatians have a reputation for stubborness at times \xe2\x80\x94 they\xe2\x80\x99re most likely to make a good fit for a seasoned dog owner who has a lot of experience training dogs.See below for all Bullmatian facts and mixed dog breed characteristics!Bullmatian Mixed Dog Breed Pictures Bullmatian Mixed Dog Breed Pictures, Characteristics, & FactsInitiate Gallery'",8 to 12 years',2,4,4,3,5,4,4,1,4,4,5,4,3,3,2,3,2,4,1,3,3,4,3,2,3,2,Mixed Breed Dogs',11 to 24 inches',https://dogtime.com/dog-breeds/bullmatian,41 to 65 pounds'
101,"b'The Cairn Terrier dog breed is a small working terrier developed on the Isle of Skye in Scotland. Farmers used them to rid their property of vermin, and they needed a dog with courage, tenacity, and intelligence\xe2\x80\x94characteristics still found in today\xe2\x80\x99s Cairn.Even though these are purebred dogs, some may still end up in the care of shelters or rescues. Consider adoption if this is the breed for you.Cairn Terriers are sensible, independent, and friendly dogs who excel as family companions. Compact and affectionate, these dogs do well in apartments and large homes with novice pet parents and experienced dog lovers, alike. They do, however, have high energy and will need their humans to keep them active with walks and play sessions. Cairn Terriers don\xe2\x80\x99t enjoy being left home alone for long hours during the day, so make sure you can provide them with plenty of love and attention for their well-being if you decide that this is the breed for you.DogTime recommends this carrier for traveling with your small Cairn Terrier.\xc2\xa0You should also pick up this interactive puzzle toy to keep your pup active indoors!See below for complete list of Cairn Terrier characteristics!Cairn Terrier Dog Breed Pictures Cairn Terrier Dog Breed Information, Pictures, Characteristics & Facts - DogtimeInitiate Gallery'",12 to 15 years',5,5,4,1,5,4,4,4,5,4,5,3,4,1,4,3,3,5,2,4,3,5,3,4,1,4,Terrier Dogs',9 to 10 inches tall at the shoulder',https://dogtime.com/dog-breeds/cairn-terrier,13 to 14 pounds'
102,"b'The Canaan Dog is a pariah dog that has survived in the desert region of Israel for thousands of years. Believed to be the dog breed that the Hebrews used in biblical times to herd and guard their flocks and encampments, some are still used by Bedouins and Druse for this purpose today.Even though these are purebred dogs, you may find them in the care of shelters or rescue groups. Remember to\xc2\xa0adopt! Don\xe2\x80\x99t shop if you want to bring a dog home.In Europe and North America, Canaan Dogs are companions and compete in dog sports such as conformation, agility, and obedience. They\xe2\x80\x99re highly adaptable and can even adjust to apartment life, so long as their humans can meet the breed\xe2\x80\x99s exercise needs. However, as an ancient pack breed, they need firm leadership and consistent training. While they\xe2\x80\x99re smart, they can also be stubborn. Use positive reinforcement, and you\xe2\x80\x99ll have a pooch who\xe2\x80\x99s eager to please.See below for complete dog breed traits and facts about Canaan Dogs!Canaan Dog Breed Pictures Canaan Dog Breed Information, Pictures, Characteristics & Facts \xe2\x80\x93 DogTimeInitiate Gallery'",12 to 15 years',4,4,3,1,4,3,5,2,4,3,2,2,3,3,5,2,4,5,5,2,3,4,4,3,3,3,Herding Dogs',19 to 24 inches tall at the shoulder',https://dogtime.com/dog-breeds/canaan-dog,35 to 55 pounds'
