274,"b'The Northern Inuit Dog is a hybrid breed with a debated background, but most agree that the Husky, Malamute, and German Shepherd Dog are part of their ancestry. Other theories include Samoyeds and Canadian Eskimo Dogs.\xc2\xa0 Though their origin is a mix, they\xe2\x80\x99re now only bred with other Northern Inuit Dogs by breeders seeking\xc2\xa0to secure purebred status for this hybrid. Calm, friendly, and intelligent, these dogs may be a great addition to your family.Despite the nickname and appearance of \xe2\x80\x9cwolfdog,\xe2\x80\x9d there is no actual wolf in their recent ancestry. Though they\xe2\x80\x99ve been popular for decades, especially among people wanting dogs who look like wolves, their popularity spiked with their casting in HBO\xe2\x80\x99s television series\xc2\xa0Game of Thrones as direwolves.Unfortunately, not all who purchase Northern Inuit Dogs end up keeping them, and they end up in shelters and rescues. So please, opt to adopt!While Northern Inuit Dogs may look like wolves, their temperament is much different. They\xe2\x80\x99re often great family dogs and will not show aggression towards their humans. The flip side of their intense loyalty is they may suffer separation anxiety, so they would best fit an environment where someone is home most of the time or with another canine companion. They have a stubborn streak and may be difficult to train, so these dogs would be best for experienced pet parents. Since they are so active, they would also prefer a house with a yard.See below for complete list of hybrid dog breed traits and facts about Northern Inuit Dogs!Northern Inuit Hybrid Dog Breed Pictures Northern Inuit Dog Hybrid Breed Pictures, Characteristics, & FactsInitiate Gallery'",12 to 15 years',1,5,3,1,5,5,4,1,4,4,4,2,4,4,3,5,5,2,2,5,4,5,4,5,1,5,Hybrid Dogs',23 to 32 inches',https://dogtime.com/dog-breeds/northern-inuit-dog,55 to 110 pounds'
275,"b'Intelligent, independent, and eager to please, the Norwegian Buhund dog breed can handle all kinds of dog jobs and sports with ease. They need lots of exercise and attention, and they\xe2\x80\x99re quick learners.Although these are fairly rare, purebred dogs, you may find them in the care of shelters and rescue groups. Remember to adopt! Don\xe2\x80\x99t shop if you want to bring one of these dogs home.As you might have guessed from their appearance, Norwegian Buhunds handle cold weather with ease. They\xe2\x80\x99re also highly affectionate to the humans in their lives, even with kids. This pup will happily join in for a fun play session in the snow!See below for complete list dog breed traits and facts about Norwegian Buhunds!Norwegian Buhund Dog Breed Pictures Norwegian Buhund Dog Breed Information, Pictures, Characteristics & FactsInitiate Gallery'",12 to 15 years',3,5,3,1,4,5,4,3,3,4,5,3,2,3,2,4,3,2,4,3,3,5,3,4,4,5,Herding Dogs',16 to 18 inches tall at the shoulder',https://dogtime.com/dog-breeds/norwegian-buhund,26 to 40 pounds'
276,"b'The gorgeous Norwegian Elkhound\xc2\xa0dog breed, with their wolf-like face, delights in life. Smart as can be, they also have a wonderful sense of humor. They\xe2\x80\x99ll race you around the kitchen island, reverse directions when you do, and then howl for sheer fun.Even though these are purebred dogs, some may still end up in the care of shelters or rescues. Consider adoption if this is the breed for you.Bold, energetic, and protective, the Norwegian Elkhound makes an excellent watchdog and guardian. Elkhounds are utterly devoted to their families. When you\xe2\x80\x99re upset, this tenderhearted Viking will plop their head on your lap. Adaptable and affectionate, both experienced pet parents and novices will find it easy to fall in love with these dogs. Just make sure you can provide plenty of exercise to meet their high energy levels. Oh, and prepare to deal with quite a bit of shedding.DogTime recommends this dog bed to give a good night\xe2\x80\x99s sleep to your medium-sized Norwegian Elkhound.\xc2\xa0You should also pick up this dog de-shedder for your high shedding pup!See all dog breed traits and facts about Norwegian Elkhounds below!Norwegian Elkhound Dog Breed Pictures Norwegian Elkhound Dog Breed Information, Pictures, Characteristics & Facts - DogTimeInitiate Gallery'",,4,5,4,1,5,5,4,4,4,3,4,4,4,3,3,4,5,3,2,4,3,4,4,4,2,5,,,https://dogtime.com/dog-breeds/norwegian-elkhound,
277,"b'With six toes on each foot \xe2\x80\x94 all of them double- or triple-jointed \xe2\x80\x94 and an amazing range of motion, the agile\xc2\xa0Norwegian Lundehund\xc2\xa0dog breed was used to scale cliffs and rob puffin nests of their eggs.Although these are purebred dogs, you may find them in the care of shelters or rescue groups. Remember to adopt! Don\xe2\x80\x99t shop if you want to bring a dog home!Along with the Norwegian Lundehund\xe2\x80\x99s acrobatic talents, they have a knack for barking and digging, making them a good choice only if you\xe2\x80\x99re prepared to give them lots of supervision and training. They can be very tough to housetrain. Experienced pet parents only!See below for complete list of dog breed traits and facts about Norwegian Lundehunds!Norwegian Lundehund Dog Breed Pictures Norwegian Lundehund Dog Breed Information, Pictures, Characteristics & Facts - DogTimeInitiate Gallery'",10 to 12 years',1,5,5,1,4,5,3,1,5,4,5,3,2,3,3,5,5,4,4,5,3,5,3,1,2,5,Working Dogs',"1 foot to 1 foot, 3 inches tall at the shoulder'",https://dogtime.com/dog-breeds/norwegian-lundehund,13 to 16 pounds'
278,"b'The Norwich Terrier originated as a ratter on farms but moved up in the world to bolt foxes from their dens during hunts. Today, they\xe2\x80\x99re amusing companions who serve double duty by keeping your home and yard free of rats and other vermin.Although these are purebred dogs, you may still find them in shelters and rescues. Remember to adopt! Don\xe2\x80\x99t shop if this is the breed for you.These highly affectionate dogs make for great apartment pets, and they\xe2\x80\x99ll get along with everybody, including kids, other dogs, and even strangers who come to your door. Make no mistake, though. These pups have high energy and need to stay physically active, and they won\xe2\x80\x99t appreciate being left home alone for long hours. Give your Norwich plenty of exercise to keep them fit and happy, and you\xe2\x80\x99ll have a loyal, loving best friend for life!DogTime recommends this carrier for traveling with your small Norwich Terrier.\xc2\xa0You should also pick up this interactive puzzle toy to keep your pup active indoors!See below for complete list of Norwich Terrier dog breed facts and traits!Norwich Terrier Dog Breed Pictures Norwich Terrier Dog Breed Information, Pictures, Characteristics & Facts \xe2\x80\x93 DogTimeInitiate Gallery'",10 to 14 years',5,5,5,1,5,4,4,3,4,4,5,5,3,1,4,4,2,2,4,5,4,5,4,4,2,4,Terrier Dogs',Up to 10 inches tall at the shoulder',https://dogtime.com/dog-breeds/norwich-terrier,Up to 12 pounds'
279,"b'The Nova Scotia Duck Tolling Retriever dog breed was created to both lure and retrieve waterfowl. This versatile breed excels in the field and show ring, in obedience and agility, and as a companion to an active family.Highly adaptable and affectionate, these dogs can even fair well in apartments, so long as their humans can keep up with providing enough exercise and lots of daily walks. Without adequate activity, they can end up growing bored and acting out with unwanted behaviors.DogTime recommends this dog bed to give a good night\xe2\x80\x99s sleep to your medium-sized Nova Scotia Duck Tolling Retriever.\xc2\xa0You should also pick up this dog water bottle for any outdoor adventures you have with your pup!See all dog breed traits and facts about Nova Scotia Duck Tolling Retrievers below!Nova Scotia Duck Tolling Retriever Dog Breed Pictures Nova Scotia Duck Trolling Retriever Dog Breed Information, Pictures, Characteristics & Facts - DogtimeInitiate Gallery'",10 to 14 years',5,5,4,1,5,5,4,3,5,3,5,4,5,3,4,3,3,5,4,4,4,5,3,4,2,4,Sporting Dogs',"1 foot, 5 inches to 1 foot, 9 inches tall at the shoulder'",https://dogtime.com/dog-breeds/nova-scotia-duck-tolling-retriever,35 to 50 pounds'
280,"b'The Old English Sheepdog is a large, athletic dog breed with an unmistakable shaggy coat. The OES, as fans call the breed for short, was historically a drover, helping farmers drive cattle and sheep to the market. Today, this good-natured dog enjoys the comfort of home life and still competes in conformation, obedience, agility, and herding trials.Even though these are purebred dogs, you may find them in the care of shelters or rescue groups. Remember to\xc2\xa0adopt! Don\xe2\x80\x99t shop if you want to bring a dog home.The OES is an adaptable, intelligent dog with an easygoing disposition. They\xe2\x80\x99re affectionate with all members of their families, and despite the fact that they are large dogs, they can fit in well with apartment life so long as they get enough exercise from walks and play sessions. Their shaggy coats also don\xe2\x80\x99t tend to shed as much as you might think. If you\xe2\x80\x99re looking for a loyal, protective, and loving family companion, this may be the breed for you!See below for complete list of dog breed traits and facts about Old English Sheepdogs!Old English Sheepdog Breed Pictures Old English Sheepdog Dog Breed Information, Pictures, Characteristics & Facts \xe2\x80\x93 DogTimeInitiate Gallery'",,5,5,4,4,4,4,4,4,4,3,4,4,3,4,2,2,1,1,3,4,2,4,4,1,2,4,,,https://dogtime.com/dog-breeds/old-english-sheepdog,
281,"b'The large and rough-coated Otterhound was originally bred for hunting otter in England. Built for work, the dog breed has a keen nose and renowned stamina.This is an uncommon breed, with fewer than ten litters born each year in the United States and Canada. Still\xc2\xa0some may still end up in the care of shelters or rescues. Consider adoption if this is the breed for you.Otterhounds are also playful clowns, friendly and affectionate with their families. They even love kids and other dogs, and they crave playtime and plenty of exercise to burn off their high energy. In fact, apartment dwellers will find it very difficult to provide enough space for them to run and move. But those who have room to roam and love to give will be rewarded with a loving companion who will never fail to delight their humans with silly antics and fun.DogTime recommends this big, spacious crate to give your big Otterhound a place to rest and relax.\xc2\xa0 You should also pick up this dog water bottle for any outdoor adventures you have with your pup!See below for complete list of Otterhound dog breed facts and characteristics!Otterhound Dog Breed Pictures Otterhound Dog Breed Information, Pictures, Characteristics & Facts - DogTimeInitiate Gallery'",,1,5,5,1,5,5,4,4,4,4,5,3,5,4,3,5,4,2,2,4,3,5,2,2,5,4,,,https://dogtime.com/dog-breeds/otterhound,
282,"b'The Papillon dog breed descends from the toy spaniels that are frequently portrayed in paintings by the Old Masters, from as far back as the 16th century. They\xe2\x80\x99re highly active and wonderful competitors in agility and obedience.Even though these are purebred dogs, you may find them in the care of shelters or rescue groups. Remember to\xc2\xa0adopt! Don\xe2\x80\x99t shop if you want to bring a dog home.The breed\xe2\x80\x99s sparkling personality makes these dogs a favorite of all who meet them. Even though you might think of Papillons as lap dogs, these pooch\xe2\x80\x99s are active and playful, and they won\xe2\x80\x99t be content lounging on the couch with you all day. They do, however, love companionship and will always try to be where their humans are. This is not the breed for you if you\xe2\x80\x99re away from home for long hours of the day. Meet the breed\xe2\x80\x99s needs, and you\xe2\x80\x99ll have a loving companion who won\xe2\x80\x99t want to leave your side!See below for complete list of dog breed traits and facts about Papillons!Papillon Dog Breed Pictures Papillon Dog Breed Information, Pictures, Characteristics & Facts \xe2\x80\x93 DogTimeInitiate Gallery'",12 to 16 years',5,5,4,1,4,5,3,5,4,3,3,3,4,1,4,1,2,3,5,5,3,5,3,2,1,2,Companion Dogs',8 to 11 inches tall at the shoulder',https://dogtime.com/dog-breeds/papillon,4 to 9 pounds'
283,"b'The Papipoo is a mixed breed dog \xe2\x80\x94 a cross between the Papillon and Poodle dog breeds. Loving, intelligent, and active, this devoted, little dog wants to be part of all family activities.Papipoos are also known as Papoodles,\xc2\xa0Papi Doodles, Papidoodles, and Papi Poos.\xc2\xa0They\xe2\x80\x99re considered \xe2\x80\x9cdesigner dogs,\xe2\x80\x9d making them in high demand, which also means they\xe2\x80\x99re readily found in shelters or rescues. Please adopt if you\xe2\x80\x99d like to add one of these pups to your life. Remember, when you adopt, you save two lives\xe2\x80\x93the one you bring home and the one you make room for at the shelter.As a cross between old-world breeds known for their intelligence and athleticism, the Papipoo has it all, with brains and brawn, not to mention beauty. Although these dogs are active, their size lends well to any dwelling, including small apartments. Their sociability makes them a good fit for all types of families, provided they get attention throughout the day. If you want an affectionate, little lapdog who may also be a contender for the Canine Olympics, this may be a perfect dog for you!See below for all Papipoo facts and mixed dog breed traits!Papipoo Mixed Dog Breed Pictures Papipoo Mixed Dog Breed Pictures, Characteristics, & FactsInitiate Gallery'",10 to 14 years',5,5,4,1,5,5,3,5,5,3,3,3,3,1,4,2,1,2,5,4,3,5,4,2,1,2,Mixed Breed Dogs',10 to 11 inches',https://dogtime.com/dog-breeds/papipoo,6 to 14 pounds'
284,"b'A Peekapoo is hybrid dog breed \xe2\x80\x94 a cross between the\xc2\xa0Pekingese and Poodle breeds. The mix makes for a wonderful companion dog who will spend their days perched on your lap or sitting by your side.Although these dogs got their start as a designer breed, you may still find them in the care of shelters and rescue groups. Adopt! Don\xe2\x80\x99t shop if you want to bring a dog home!These dogs are loyal and affectionate and can be quite protective of the people they love \xe2\x80\x94 which tends to be hilarious in such a small dog. Affectionate and playful, these pups get along with all members of the family. They can even make great companions for novice pet parents. Whether you live in an apartment or a large house with a yard, Peekapoos will make themselves at home. They\xe2\x80\x99ll be happy as long as they can stay by your side. Just don\xe2\x80\x99t leave them home alone for too long during the day, or you may see signs of separation anxiety.See below for complete list hybrid dog breed traits and facts about Peekapoos!Peekapoo Hybrid Dog Breed Pictures Peekapoo Hybrid Dog Breed Information, Pictures, Characteristics & Facts \xe2\x80\x93 DogTimeInitiate Gallery'",10 to 15 years',5,5,4,1,3,3,3,5,4,2,4,4,3,1,2,1,2,2,3,3,4,4,4,4,2,3,Hybrid Dogs',Up to 11 inches tall at the shoulder',https://dogtime.com/dog-breeds/peekapoo,4 to 20 pounds'
285,"b'Pekingese dogs were bred for centuries to be the cherished companions of the imperial family of China. Today they\xe2\x80\x99re still cherished family companions and show dogs who greet everyone they meet with dignity and grace.Even though these are purebred dogs, you may find them in the care of shelters or rescue groups. Remember to\xc2\xa0adopt! Don\xe2\x80\x99t shop if you want to bring a dog home.The Peke is an adaptable dog who can live with just about anybody, including apartment dwellers and novice pet parents. However, they have a tendency to bark, which neighbors might not be too thrilled about. They also tend to stick to one human caretaker most of all. Children may injure them during rough play, so they\xe2\x80\x99re best suited to homes with teens and adults. If you can meet the breed\xe2\x80\x99s needs, you\xe2\x80\x99ll have a loving, loyal companion who won\xe2\x80\x99t want to leave your side!See below for complete list of dog breed traits and facts about Pekingese!Pekingese Dog Breed Pictures Pekingese Dog Breed Information, Pictures, Characteristics & Facts \xe2\x80\x93 DogTimeInitiate Gallery'",12 to 15 years',5,5,2,1,2,2,2,4,4,1,2,3,5,1,1,3,4,1,3,2,3,3,2,4,3,4,Companion Dogs',6 to 9 inches tall at the shoulder',https://dogtime.com/dog-breeds/pekingese,7 to 14 pounds'
286,"b'Originally bred to herd cattle, sheep, and horses, the Pembroke Welsh Corgi is an active and intelligent dog breed. Easy to train and eager to learn, Pembrokes are great with children and other pets, and you can find them in four different coat colors and markings.Even though these are purebred dogs, you may find them in the care of shelters or rescue groups. Remember to\xc2\xa0adopt! Don\xe2\x80\x99t shop if you want to bring a dog home.Adaptable and loving with the whole family, Corgis can fit into just about any household, whether it\xe2\x80\x99s an apartment or large home with a yard. However, they do have quite a bit of energy for a small dog. They\xe2\x80\x99ll need plenty of walks and active play sessions. You might be surprised by how quickly these short-legged pups can move! For humans who can meet the breed\xe2\x80\x99s needs, the Pembroke will make an excellent family companion, even for novice pet parents.See below for complete list of dog breed traits and facts about Pembroke Welsh Corgis!Pembroke Welsh Corgi Dog Breed Pictures Pembroke Welsh Corgi Dog Breed Information, Pictures, Characteristics & Facts - DogtimeInitiate Gallery Stuff For Corgi Fans'",12 to 14 years',4,5,3,1,4,4,3,4,5,3,4,4,3,2,3,2,5,4,5,5,2,4,4,5,3,4,Herding Dogs',10 to 12 inches tall at the shoulder',https://dogtime.com/dog-breeds/pembroke-welsh-corgi,Up to 30 pounds'
287,"b'The Petit Basset Griffon Vend\xc3\xa9en is a small scent hound who has won the hearts of millions. Although the dog breed appears to be designed for winsome cuteness, in actuality, PBGVs are tough hunters who were developed for a specific purpose: to hunt small game in the rough terrain of the Vendeen region of France. The breed is known for a merry and outgoing personality.Even though these are purebred dogs, some may still end up in the care of shelters or rescues. Consider adoption if this is the breed for you.Adaptable and affectionate, these pups can fair well in apartment living situations. They do have high energy levels, though, and because of that, they need plenty of exercise. PBGVs can also have a stubborn streak, so they\xe2\x80\x99ll need plenty of consistent training with lots of positive reinforcement. If you can provide this pooch with lots of physical activity and care, you\xe2\x80\x99ll be rewarded with a loving companion for the whole family, even for other resident canines.DogTime recommends this dog bed to give a good night\xe2\x80\x99s sleep to your medium-sized Petit Basset Griffon Vend\xc3\xa9en.\xc2\xa0You should also pick up this interactive puzzle toy to keep your pup active indoors!See below for complete list of Petit Basset Griffon Vend\xc3\xa9en characteristics!Petit Basset Griffon Vend\xc3\xa9en Dog Breed Pictures Petit Basset Griffon Vendeen Dog Breed Information, Pictures, Characteristics & Facts - DogtimeInitiate Gallery'",Starts at 14 years',4,5,5,1,5,5,3,3,4,4,5,4,5,2,3,5,4,2,1,5,3,5,3,5,3,4,Hound Dogs',13 to 15 inches tall at the shoulder',https://dogtime.com/dog-breeds/petit-basset-griffon-vendeen,30 to 40 pounds'
288,"b'The Pharaoh Hound is an ancient dog breed that\xe2\x80\x99s changed little since their development more than 5,000 years ago. They were the dogs of kings and may have hunted gazelles with pharaohs, hence their name. This loyal hunting companion later made their way to Malta, where they\xe2\x80\x99re now the national dog.Even though these are purebred dogs, some may still end up in the care of shelters or rescues. Consider adoption if this is the breed for you.You need not be royalty to befriend the Pharaoh Hound. Adaptable and affectionate, these pups make great family companions, even for novice pet parents and apartment dwellers. Pharaoh Hounds delight their humans with clownish antics and will love to make you laugh. They also have a sensitive side, though, and are even known to blush! Return this pup\xe2\x80\x99s love in kind, and you\xe2\x80\x99ll have a loyal friend for life.DogTime recommends this dog bed to give a good night\xe2\x80\x99s sleep to your medium-sized Pharaoh Hound. You should also pick up this interactive puzzle toy to keep your pup active indoors!See below for complete list of dog breed traits and facts about Pharaoh Hounds!Pharaoh Hound Dog Breed Pictures Pharaoh Hound Dog Breed Information, Pictures, Characteristics, & Facts - DogTimeInitiate Gallery'",11 to 14 years',4,5,5,1,2,4,5,4,4,3,5,3,5,3,5,4,2,4,3,4,4,4,5,4,2,1,Hound Dogs',21 to 25 inches tall at the shoulder',https://dogtime.com/dog-breeds/pharaoh-hound,45 to 55 pounds'
289,"b'The Pitsky is a mixed breed dog \xe2\x80\x94 a cross between the American Pit Bull Terrier and Siberian Husky dog breeds. They range in size from medium to large, they are energetic, and loyal, these pups inherited some of the best qualities from both of their parents.Pitskies don\xe2\x80\x99t go by any other names \xe2\x80\x94 maybe because Hutbull doesn\xe2\x80\x99t have the same ring \xe2\x80\x94 just Pitsky or Husky/Pit mix or Pit/Husky mix. Despite their unfortunate status as a designer breed, you may find these mixed breed dogs in shelters and rescues. So remember to adopt! Don\xe2\x80\x99t shop!These high energy dogs need fast-paced lifestyles. Novice dog parents are not recommended. Pitskies are demanding and high maintenance. If you love Siberian Huskies and American Pit Bull Terriers and have experience with both, then this mixed breed may be a perfect choice for you!See below for all mixed dog breed traits and facts about Pitskies!Pitsky Mixed Dog Breed Pictures Pitsky Mixed Dog Breed Pictures, Characteristics, & FactsInitiate Gallery'",12 to 16 years',2,5,3,2,4,5,4,1,3,4,5,2,3,3,3,4,4,3,3,5,4,5,4,4,1,3,Mixed Breed Dogs',16 to 25 inches',https://dogtime.com/dog-breeds/pitsky,30 to 80 pounds'
290,"b'The pack-hunting Plott\xc2\xa0dog breed was developed in North Carolina more than 200 years ago to hunt bear and wild boar. They are still used as hunting dogs today and have proven their worth as pack hunters. They also participate in tracking and other dog sports.Even though these are purebred dogs, some may still end up in the care of shelters or rescues. Consider adoption if this is the breed for you.Plotts are best suited to life in the country where they have plenty of room to roam. They need lots of exercise and, due to their pack hunting heritage, would likely prefer a home with at least one other resident canine. Socialization is a must with this breed. Make sure you have a high fence, wherever you live, if you bring one of these pups home, though. They love to chase and wander. Give your dog plenty of physical activity and consistent training, and you\xe2\x80\x99ll be rewarded with a loyal companion for life.DogTime recommends this dog bed to give a good night\xe2\x80\x99s sleep to your medium-sized Plott.\xc2\xa0You should also pick up this dog brush and massager for your short-haired pup!See below for complete list of Plott dog breed facts and characteristics!Plott Dog Breed Pictures Plott Dog Breed Information, Pictures, Characteristics & Facts - DogTimeInitiate Gallery'",12 to 14 years',1,4,5,1,4,5,5,1,3,4,3,3,5,3,4,5,2,5,4,3,3,3,4,1,2,2,Hound Dogs',20 to 27 inches tall at the shoulder',https://dogtime.com/dog-breeds/plott,40 to 75 pounds'
291,"b'Smaller than the average Beagle dog breed, these compact scenthounds are merry and fun-loving. But the Pocket Beagle is still a hound and, as such, requires patience and creative training techniques to overcome their sometimes stubborn nature.Even though these are purebred dogs, you may find them in the care of shelters or rescue groups. Remember to\xc2\xa0adopt! Don\xe2\x80\x99t shop if you want to bring a dog home.Pocket Beagles are super affectionate with their families, including other dogs and kids. They\xe2\x80\x99re energetic and playful, too, so they make for excellent playmates. Just make sure children know how to properly and safely interact with a small dog, and supervise play sessions, as even well trained Beagles can get a little rambunctious. Apartment dwellers can also enjoy this breed, provided they can give their dogs plenty of exercise and walks. These pups get along with just about everybody! Just don\xe2\x80\x99t leave them home alone for too long, or they may act out in unwanted ways.See below for complete Pocket Beagle characteristics!Pocket Beagle Dog Breed Pictures Pocket Beagle Dog Breed Information, Pictures, Characteristics & Facts \xe2\x80\x93 DogTimeInitiate Gallery'",Starts at 10 years',4,5,5,1,4,4,3,3,4,4,5,5,3,2,4,5,3,5,3,4,4,4,4,5,2,2,Hound Dogs',7 to 12 inches tall at the shoulder',https://dogtime.com/dog-breeds/pocket-beagle,7 to 15 pounds'
